{
  "automatic_publication_performed": false,
  "completed_at": "2026-08-11T00:24:44.896020Z",
  "completed_count": 12,
  "duplicate_count": 0,
  "failed_count": 0,
  "failure_seam_observed": false,
  "human_review_completed": false,
  "model": "gpt-4.1-mini-2025-04-14",
  "provider": "OpenAI",
  "resume_sequence": 7,
  "review_destination": "alt_text_suggestion",
  "run_id": "langgraph-20260810T231915Z-0027cd3e",
  "schema_version": 1,
  "source_article_unchanged": true,
  "source_framework": "langgraph",
  "started_at": "2026-08-10T23:19:25.829609Z",
  "status": "pass",
  "target_count": 12,
  "temperature": 0.0,
  "validator_version": "gate05-validator-1.0.0"
}
